{
  "comparison": {
    "first_label": "arm_a_schedutil",
    "group_failure_percent_delta": -0.0007142857142857143,
    "group_read_calls_mean_delta": 2.3051999999999992,
    "operation": "arm_b_performance minus arm_a_schedutil",
    "phase_delta_us": {
      "bus_total": {
        "max": -3531.0679999999993,
        "mean": -1540.4662229000014,
        "p99_9": -3545.028126
      },
      "exchange_unattributed_gap": {
        "max": -857.2969999999989,
        "mean": -386.5078111999999,
        "p99_9": -840.1323740000012
      },
      "extended_flush": {
        "max": -34.459,
        "mean": -20.739317,
        "p99_9": -33.372666999999524
      },
      "extended_parse_tail": {
        "max": -158.83499999999998,
        "mean": -74.5331104,
        "p99_9": -166.70883399999997
      },
      "extended_rx_span": {
        "max": 0.0,
        "mean": 0.0,
        "p99_9": 0.0
      },
      "extended_tx_return_to_first_rx": {
        "max": -163.71000000000004,
        "mean": -54.88395850000006,
        "p99_9": -194.24933399999964
      },
      "extended_write_call": {
        "max": -124.084,
        "mean": -70.2325364,
        "p99_9": -141.83212499999942
      },
      "group_flush": {
        "max": -27.834000000000003,
        "mean": -4.711731700000001,
        "p99_9": -30.41587499999997
      },
      "group_parse_tail": {
        "max": -1990.052,
        "mean": -802.2339781999999,
        "p99_9": -1966.8023750000002
      },
      "group_rx_span": {
        "max": -524.3799999999999,
        "mean": 40.41995280000015,
        "p99_9": -153.81908400000475
      },
      "group_state_decode_gap": {
        "max": -784.171,
        "mean": -346.36560790000004,
        "p99_9": -766.543877
      },
      "group_tx_return_to_first_rx": {
        "max": 1087.583,
        "mean": -71.32985440000004,
        "p99_9": -247.9973329999989
      },
      "group_write_call": {
        "max": -140.959,
        "mean": -19.086774699999992,
        "p99_9": -149.58379099999996
      },
      "sync_write_call": {
        "max": -454.29499999999996,
        "mean": -75.62094770000002,
        "p99_9": -466.4623350000005
      }
    },
    "second_label": "arm_b_performance"
  },
  "datasets": [
    {
      "collector_observation": {
        "application_completion_buckets": {
          "count": 10000,
          "max": 14.0,
          "mean": 9.6714,
          "min": 5.0,
          "p95": 13.0,
          "p99": 13.0,
          "p99_9": 14.0
        },
        "clean_group_read_calls": {
          "count": 9999,
          "max": 14.0,
          "mean": 9.671067106710671,
          "min": 5.0,
          "p95": 13.0,
          "p99": 13.0,
          "p99_9": 14.0
        },
        "exact_length_contract": {
          "applicable": true,
          "bytes_before_first_parse_histogram": {
            "140": 10000
          },
          "clean_contract_violation_ticks": [],
          "expected_byte_histogram": {
            "140": 10000
          },
          "mode_counts": {
            "exact_length_then_parse": 10000
          },
          "parse_call_histogram": {
            "1": 10000
          },
          "parser_mode_counts": {},
          "pass": true
        },
        "failed_group_read_calls": {
          "count": 1,
          "max": 13.0,
          "mean": 13.0,
          "min": 13.0,
          "p95": 13.0,
          "p99": 13.0,
          "p99_9": 13.0
        },
        "group_read_call_histogram": {
          "10": 369,
          "11": 1503,
          "12": 2599,
          "13": 1116,
          "14": 37,
          "5": 1,
          "6": 603,
          "7": 3601,
          "8": 92,
          "9": 79
        },
        "group_read_calls": {
          "count": 10000,
          "max": 14.0,
          "mean": 9.6714,
          "min": 5.0,
          "p95": 13.0,
          "p99": 13.0,
          "p99_9": 14.0
        },
        "instrumentation": "exact-length collector transaction trace v2"
      },
      "correlations": {
        "group_read_calls_vs_bus_total": -0.9568602131475304,
        "group_read_calls_vs_group_failure_indicator": 0.01315972710272134,
        "group_read_calls_vs_group_rx_span": 0.40554953525949206,
        "group_read_calls_vs_parse_tail": -0.9536688096701745
      },
      "group_failures": {
        "clean_ticks": 9999,
        "expected_outcomes": 140000,
        "extended_status_counts": {
          "ok": 10000
        },
        "failed_outcomes": 1,
        "failed_ticks": 1,
        "failure_percent": 0.0007142857142857143,
        "status_counts": {
          "crc": 1,
          "ok": 139999
        },
        "write_status_counts": {
          "ok": 10000
        }
      },
      "label": "arm_a_schedutil",
      "per_servo": [
        {
          "completion_from_request_write_return_us": {
            "count": 10000,
            "max": 1752.257,
            "mean": 1019.4715691,
            "min": 611.919,
            "p95": 1213.33805,
            "p99": 1225.54908,
            "p99_9": 1256.2976250000002
          },
          "logical_index": 0,
          "missing_completion_count": 0,
          "servo_id": 20,
          "status_counts": {
            "ok": 10000
          },
          "wire_index": 0
        },
        {
          "completion_from_request_write_return_us": {
            "count": 10000,
            "max": 1752.257,
            "mean": 1126.5091733000002,
            "min": 716.544,
            "p95": 1427.17615,
            "p99": 1472.04701,
            "p99_9": 1499.132041
          },
          "logical_index": 1,
          "missing_completion_count": 0,
          "servo_id": 21,
          "status_counts": {
            "ok": 10000
          },
          "wire_index": 1
        },
        {
          "completion_from_request_write_return_us": {
            "count": 10000,
            "max": 1752.257,
            "mean": 1272.6764817,
            "min": 781.546,
            "p95": 1478.3453,
            "p99": 1496.38325,
            "p99_9": 1574.3822510000005
          },
          "logical_index": 2,
          "missing_completion_count": 0,
          "servo_id": 22,
          "status_counts": {
            "crc": 1,
            "ok": 9999
          },
          "wire_index": 2
        },
        {
          "completion_from_request_write_return_us": {
            "count": 10000,
            "max": 2120.092,
            "mean": 1363.2341143,
            "min": 938.254,
            "p95": 1492.21405,
            "p99": 1605.5576000000003,
            "p99_9": 1729.633208
          },
          "logical_index": 3,
          "missing_completion_count": 0,
          "servo_id": 23,
          "status_counts": {
            "ok": 10000
          },
          "wire_index": 3
        },
        {
          "completion_from_request_write_return_us": {
            "count": 10000,
            "max": 2152.093,
            "mean": 1502.6016111000001,
            "min": 1068.713,
            "p95": 1720.96715,
            "p99": 1783.1324200000001,
            "p99_9": 1831.925082
          },
          "logical_index": 4,
          "missing_completion_count": 0,
          "servo_id": 24,
          "status_counts": {
            "ok": 10000
          },
          "wire_index": 4
        },
        {
          "completion_from_request_write_return_us": {
            "count": 10000,
            "max": 2366.676,
            "mean": 1620.8156527000003,
            "min": 1214.088,
            "p95": 1834.9333,
            "p99": 1917.92441,
            "p99_9": 1970.7587510000003
          },
          "logical_index": 5,
          "missing_completion_count": 0,
          "servo_id": 30,
          "status_counts": {
            "ok": 10000
          },
          "wire_index": 5
        },
        {
          "completion_from_request_write_return_us": {
            "count": 10000,
            "max": 2366.676,
            "mean": 1812.6954059,
            "min": 1351.506,
            "p95": 2030.2190500000002,
            "p99": 2083.13441,
            "p99_9": 2098.0544590000013
          },
          "logical_index": 6,
          "missing_completion_count": 0,
          "servo_id": 31,
          "status_counts": {
            "ok": 10000
          },
          "wire_index": 6
        },
        {
          "completion_from_request_write_return_us": {
            "count": 10000,
            "max": 2615.886,
            "mean": 1877.8225324999999,
            "min": 1439.922,
            "p95": 2084.8062,
            "p99": 2199.6800100000005,
            "p99_9": 2217.3000840000004
          },
          "logical_index": 7,
          "missing_completion_count": 0,
          "servo_id": 32,
          "status_counts": {
            "ok": 10000
          },
          "wire_index": 7
        },
        {
          "completion_from_request_write_return_us": {
            "count": 10000,
            "max": 2615.886,
            "mean": 1982.7948511999998,
            "min": 1579.59,
            "p95": 2206.634,
            "p99": 2223.7616500000004,
            "p99_9": 2281.5966660000004
          },
          "logical_index": 8,
          "missing_completion_count": 0,
          "servo_id": 33,
          "status_counts": {
            "ok": 10000
          },
          "wire_index": 8
        },
        {
          "completion_from_request_write_return_us": {
            "count": 10000,
            "max": 2875.262,
            "mean": 2142.1764677,
            "min": 1718.883,
            "p95": 2363.92905,
            "p99": 2429.8061700000003,
            "p99_9": 2444.3850840000005
          },
          "logical_index": 9,
          "missing_completion_count": 0,
          "servo_id": 10,
          "status_counts": {
            "ok": 10000
          },
          "wire_index": 9
        },
        {
          "completion_from_request_write_return_us": {
            "count": 10000,
            "max": 2875.262,
            "mean": 2343.3704704,